{
  "object_type": "agp.trust-policy/2",
  "policy_id": "policy:golden:required-signer",
  "version": 2,
  "eligible_roles": [
    "approver"
  ],
  "requirements": [
    {
      "requirement_id": "requirement:required-signer",
      "type": "required_signer",
      "signer_id": "authority:alpha"
    }
  ]
}
