[
  {
    "object_type": "agp.trust-policy/2",
    "policy_id": "policy:golden:reviewer-failed",
    "version": 1,
    "eligible_roles": [
      "reviewer"
    ],
    "requirements": [
      {
        "requirement_id": "requirement:alpha-required",
        "type": "required_signer",
        "signer_id": "authority:alpha"
      }
    ]
  }
]
